{
  "id": "connector-mock-ticketing",
  "version": "1.0.0",
  "owner": "security-operations",
  "provider": "mock-ticketing",
  "intents": ["create_ticket", "update_ticket", "health"],
  "auth": {"method": "none", "scopes": []},
  "error_classes": ["validation", "not_found", "policy_denied"],
  "health_check": {"read_only": true, "timeout_seconds": 5},
  "dry_run": true,
  "idempotency": true,
  "data_classification": "internal",
  "timeout_seconds": 5,
  "retry_policy": {"max_attempts": 1, "backoff_seconds": [0]},
  "rate_limit": {"requests_per_minute": 600},
  "target_allowlist": ["tickets"]
}
